{"schema_version":"1.0.0","proposal_id":"ca.sco.segment.500_plus.property_type_semantic_verification","proposal_version":"1.0.0","source_id":"ca.sco.unclaimed_property.bulk","source_segment_id":"ca.sco.unclaimed_property.bulk.500_plus","jurisdiction":"CA","proposal_status":"PROPOSAL_ONLY_NOT_AUTHORIZED","prepared_on":"2026-09-15","source_approved":false,"source_enabled":false,"real_acquisition_authorized":false,"network_execution_authorized":false,"row_access_authorized":false,"network_request_performed":false,"body_access_performed":false,"execution_approval_ref":null,"canonical_refs":{"structure_evidence_ref":"sources/evidence/ca_sco_segment_500_plus.data_scope.execution.v1.json","field_privacy_readiness_ref":"sources/proposals/ca_sco_segment_500_plus.field_privacy_readiness.v1.json","source_access_policy_ref":"policies/states/CA/ca_sco_unclaimed_property_bulk.source_access.v1.json","registry_ref":"sources/registry.yaml"},"authority_reference":{"sco_naupa_codes_ref":"https://www.sco.ca.gov/Files-UPD/upd_naupa_II_codes_dormancy_periods.pdf","authority_checked_on":"2026-09-15","authority_statement":"The SCO document states that the listed NAUPA standard codes are used by California.","official_insurance_codes":["IN01","IN02","IN03","IN04","IN05","IN06","IN07","IN08","IN99"],"insurance_code_meanings":{"IN01":"Individual Policy Benefits or Claim Payments","IN02":"Group Policy Benefits or Claim Payments","IN03":"Proceeds Due Beneficiaries","IN04":"Proceeds from Matured Policies, Endowments, or Annuities","IN05":"Premium Refunds","IN06":"Unidentified Remittances","IN07":"Other Amounts Due Under Policy Terms","IN08":"Agent Credit Balances","IN99":"Aggregate Insurance Property"}},"semantic_question":{"field":"PROPERTY_TYPE","question_id":"VERIFY_BOUNDED_BULK_PROPERTY_TYPE_SAMPLE_AGAINST_SCO_NAUPA_INSURANCE_SEMANTICS","question":"In a deterministic bounded prefix sample across all four canonical CSV members, are PROPERTY_TYPE values NAUPA-style code tokens, and is every observed IN-prefixed value one of the official California SCO insurance codes IN01-IN08 or IN99?","proof_boundary":"SAMPLE_ONLY_DOES_NOT_PROVE_FULL_DATASET_DOMAIN_OR_GLOBAL_CODE_FREQUENCY","production_classification_activation_allowed":false},"sample_plan":{"selection_mode":"FIRST_COMPLETE_DATA_ROWS_AFTER_VERIFIED_HEADER_PER_CANONICAL_MEMBER","canonical_member_count":4,"canonical_members":[{"name":"From_500_To_Beyond_1_of_4.csv","local_header_offset":0},{"name":"From_500_To_Beyond_2_of_4.csv","local_header_offset":59747797},{"name":"From_500_To_Beyond_3_of_4.csv","local_header_offset":96862896},{"name":"From_500_To_Beyond_4_of_4.csv","local_header_offset":134174190}],"data_rows_max_per_member":4,"data_rows_max_total":16,"header_rows_counted_as_data":false,"representativeness_claimed":false,"sample_bias_note":"Prefix sampling is deterministic and privacy-minimized; it is not statistically representative."},"transport_caps":{"endpoint":"https://claimit.ca.gov/upd-property-records/04_From_500_To_Beyond.zip","expected_content_length":162416884,"expected_etag":"\"b25b315b6cd8007624387c3a00d4b1fe\"","expected_media_type":"application/zip","expected_accept_ranges":"bytes","https_required":true,"allowed_host":"claimit.ca.gov","redirects_allowed":false,"if_match_required":true,"network_inactivity_timeout_seconds":10,"head_requests_max":1,"range_requests_max":4,"http_requests_max_total":5,"range_response_bytes_max_each":131072,"total_source_response_body_bytes_max":524288,"uncompressed_transient_bytes_max_each":262144,"uncompressed_transient_bytes_max_total":1048576,"logical_record_bytes_max":32768,"full_body_request_allowed":false,"additional_range_on_incomplete_sample_allowed":false,"budget_basis":"PROJECT_SAFETY_CAPS_NOT_SOURCE_FACTS"},"row_processing_controls":{"expected_column_count":25,"header_must_match_canonical_labels_exactly":true,"property_type_column_index_zero_based":1,"property_type_code_shape_regex":"^(?:[A-Z]{2}[0-9]{2}|ZZZZ)$","insurance_prefix":"IN","observed_in_prefixed_value_must_be_in_official_insurance_codes":true,"noninsurance_code_semantics_claimed":false,"property_id_use_allowed":false,"nonallowlisted_field_use_allowed":false,"nonallowlisted_field_persistence_allowed":false,"full_row_persistence_allowed":false},"privacy_and_persistence":{"transient_full_row_bytes_may_be_observed":true,"transient_row_privacy_approval_required_before_execution":true,"temporary_source_files_allowed":false,"raw_zip_persistence_allowed":false,"raw_range_body_persistence_allowed":false,"raw_full_row_persistence_allowed":false,"property_id_persistence_allowed":false,"derived_property_type_summary_persistence_allowed":true,"per_row_property_type_persistence_allowed":false,"allowed_persisted_derived_fields":["sample_rows_examined","rows_examined_per_member","distinct_property_type_codes","distinct_insurance_codes","semantic_result_status","stop_reason"],"transient_buffer_retention_days":0,"transient_buffer_disposal":"IMMEDIATE_AFTER_PROJECTION_OR_STOP","record_values_in_logs_allowed":false,"raw_bytes_in_logs_allowed":false,"owner_holder_values_in_logs_allowed":false,"property_id_in_logs_allowed":false,"property_type_per_row_logs_allowed":false},"semantic_outcomes":{"success_status":"SAMPLE_COMPATIBLE_INSURANCE_CODE_OBSERVED","inconclusive_status":"SAMPLE_CODE_SHAPE_COMPATIBLE_NO_INSURANCE_CODE_OBSERVED","stop_status":"STOPPED_FAIL_CLOSED","success_requires":["AT_LEAST_ONE_DATA_ROW_FROM_EACH_CANONICAL_MEMBER","ALL_OBSERVED_PROPERTY_TYPE_VALUES_MATCH_CODE_SHAPE","AT_LEAST_ONE_OFFICIAL_INSURANCE_CODE_OBSERVED","EVERY_OBSERVED_IN_PREFIXED_VALUE_IS_OFFICIAL_INSURANCE_CODE"],"inconclusive_when":["ALL_OBSERVED_PROPERTY_TYPE_VALUES_MATCH_CODE_SHAPE","NO_IN_PREFIXED_VALUE_OBSERVED"],"production_activation_after_success":false},"stop_conditions":["TRANSPORT_METADATA_DRIFT","RANGE_RESPONSE_NOT_PARTIAL","CONTENT_RANGE_MISMATCH","CANONICAL_MEMBER_METADATA_MISMATCH","HEADER_MISMATCH","CSV_PARSE_ERROR","ROW_COLUMN_COUNT_MISMATCH","PROPERTY_TYPE_EMPTY","PROPERTY_TYPE_FORMAT_UNEXPECTED","UNRECOGNIZED_INSURANCE_PREFIX_CODE","LOGICAL_RECORD_LIMIT_EXCEEDED","UNCOMPRESSED_TRANSIENT_LIMIT_EXCEEDED","ROW_SAMPLE_INCOMPLETE_WITHIN_MEMBER_PREFIX_CAP","ROW_LIMIT_EXCEEDED","REQUEST_LIMIT_EXCEEDED","BYTE_BUDGET_EXCEEDED","PRIVACY_APPROVAL_MISSING","UNEXPECTED_RESPONSE_BODY_BEHAVIOR"],"safety_state":{"source_approval_granted":false,"semantic_execution_authorized":false,"real_row_access_authorized":false,"pii_processing_authorized":false,"identity_resolution_allowed":false,"beneficiary_matching_allowed":false,"outreach_allowed":false,"source_policy_update_allowed":false,"registry_activation_allowed":false},"implementation_state":{"execution_runner_present":false,"network_workflow_present":false,"proposal_execution_performed":false},"next_gate":"HUMAN_PROPERTY_TYPE_SEMANTIC_EXECUTION_REVIEW"}
